{
    "$schema": "http://json-schema.org/draft-07/schema#",
    "title": "AlertQueueSchema",
    "type": "array",
    "items": {
        "type": "object",
        "required": [
            "alert_id",
            "generated_at",
            "rule_id",
            "rule_title",
            "rule_level",
            "priority_score",
            "event_ref",
            "event_summary",
            "asset_context",
            "attack_techniques",
            "status",
            "evidence_hash"
        ],
        "properties": {
            "alert_id": { "type": "string", "format": "uuid" },
            "generated_at": { "type": "string", "format": "date-time" },
            "rule_id": { "type": "string", "format": "uuid" },
            "rule_title": { "type": "string" },
            "rule_level": { "type": "string" },
            "priority_score": { "type": "number" },
            "event_ref": { "type": "string" },
            "event_summary": {
                "type": "object",
                "required": ["timestamp", "hostname", "user"],
                "properties": {
                    "timestamp": { "type": "string" },
                    "hostname": { "type": "string" },
                    "user": { "type": "string" },
                    "src_ip": { "type": "string" },
                    "dst_ip": { "type": "string" },
                    "process_name": { "type": "string" },
                    "canonical_label": { "type": "string" },
                    "event_category": { "type": "string" }
                }
            },
            "asset_context": { "type": "object" },
            "attack_techniques": { "type": "array", "items": { "type": "string" } },
            "status": { "type": "string", "enum": ["new", "triaged", "dismissed"] },
            "evidence_hash": { "type": "string" }
        }
    }
}
