[
    {
        "alert_id": "e5513f5c-897c-54a8-9d62-bc108bb6b38c",
        "generated_at": "2026-06-07T23:00:00Z",
        "rule_id": "c1a0b010-4411-4afb-aa77-10ff9eeae1df",
        "rule_title": "010 credential_theft_chain",
        "rule_level": "critical",
        "priority_score": 30.0,
        "event_ref": "evt_010_01",
        "event_summary": {
            "timestamp": "2026-06-07T08:15:30Z",
            "hostname": "db-patient-01",
            "user": "SYSTEM",
            "src_ip": "10.240.12.4",
            "dst_ip": "10.240.12.9",
            "process_name": "lsass.exe",
            "canonical_label": "credential_dumping",
            "event_category": "process_creation"
        },
        "asset_context": { "criticality": "high", "zone": "secure-db" },
        "attack_techniques": ["T1003"],
        "status": "new",
        "evidence_hash": "a54f128bc9612345e6789101112131415161718192021222324252627282930a"
    },
    {
        "alert_id": "f5513f5c-897c-54a8-9d62-bc108bb6b38d",
        "generated_at": "2026-06-07T23:01:00Z",
        "rule_id": "b2a0b011-4411-4afb-aa77-11ff9eeae1df",
        "rule_title": "011 patient_data_access",
        "rule_level": "critical",
        "priority_score": 24.5,
        "event_ref": "evt_011_04",
        "event_summary": {
            "timestamp": "2026-06-07T09:20:11Z",
            "hostname": "meddb-01",
            "user": "srv_sqladmin",
            "src_ip": "10.240.14.33",
            "dst_ip": "10.240.12.9",
            "process_name": "sqlservr.exe",
            "canonical_label": "data_harvest",
            "event_category": "database_query"
        },
        "asset_context": { "criticality": "high", "zone": "clinical-data" },
        "attack_techniques": ["T1115"],
        "status": "new",
        "evidence_hash": "b54f128bc9612345e6789101112131415161718192021222324252627282930b"
    },
    {
        "alert_id": "35513f5c-897c-54a8-9d62-bc108bb6b38e",
        "generated_at": "2026-06-07T23:02:00Z",
        "rule_id": "d2a0b012-4411-4afb-aa77-12ff9eeae1df",
        "rule_title": "012 medical_segment_egress",
        "rule_level": "critical",
        "priority_score": 21.0,
        "event_ref": "evt_012_09",
        "event_summary": {
            "timestamp": "2026-06-07T10:02:45Z",
            "hostname": "med-img-02",
            "user": "dicom_user",
            "src_ip": "10.240.45.12",
            "dst_ip": "203.0.113.50",
            "process_name": "rclone",
            "canonical_label": "egress_anomaly",
            "event_category": "network_flow"
        },
        "asset_context": { "criticality": "high", "zone": "imaging" },
        "attack_techniques": ["T1048"],
        "status": "new",
        "evidence_hash": "c54f128bc9612345e6789101112131415161718192021222324252627282930c"
    },
    {
        "alert_id": "45513f5c-897c-54a8-9d62-bc108bb6b38f",
        "generated_at": "2026-06-07T23:03:00Z",
        "rule_id": "a1a0b001-4411-4afb-aa77-01ff9eeae1df",
        "rule_title": "001 ssh_brute_force",
        "rule_level": "high",
        "priority_score": 18.0,
        "event_ref": "evt_001_88",
        "event_summary": {
            "timestamp": "2026-06-07T11:40:00Z",
            "hostname": "db-patient-01",
            "user": "root",
            "src_ip": "198.51.100.12",
            "dst_ip": "10.240.12.4",
            "process_name": "sshd",
            "canonical_label": "failed_logon",
            "event_category": "authentication"
        },
        "asset_context": { "criticality": "high", "zone": "secure-db" },
        "attack_techniques": ["T1110.001"],
        "status": "new",
        "evidence_hash": "d54f128bc9612345e6789101112131415161718192021222324252627282930d"
    },
    {
        "alert_id": "55513f5c-897c-54a8-9d62-bc108bb6b390",
        "generated_at": "2026-06-07T23:04:00Z",
        "rule_id": "b1a0b009-4411-4afb-aa77-09ff9eeae1df",
        "rule_title": "009 lateral_movement_smb",
        "rule_level": "high",
        "priority_score": 16.0,
        "event_ref": "evt_009_12",
        "event_summary": {
            "timestamp": "2026-06-07T12:11:15Z",
            "hostname": "clin-ws-07",
            "user": "adm_local",
            "src_ip": "10.240.10.105",
            "dst_ip": "10.240.10.120",
            "process_name": "ntoskrnl.exe",
            "canonical_label": "smb_lateral",
            "event_category": "network_flow"
        },
        "asset_context": { "criticality": "medium", "zone": "clinical-workstation" },
        "attack_techniques": ["T1021.002"],
        "status": "new",
        "evidence_hash": "e54f128bc9612345e6789101112131415161718192021222324252627282930e"
    }
]
